{
  "schema_version": "diagram-model.v1",
  "diagram_key": "dense_activity",
  "title": "Actividad de resolucion",
  "description": "Fixture UML Activity con decisiones repetidas y rutas alternativas.",
  "notation": "uml_activity",
  "direction": "LR",
  "nodes": [
    {"id": "start", "label": "Inicio", "kind": "start"},
    {"id": "receive", "label": "Recibir solicitud", "kind": "activity"},
    {"id": "interpret", "label": "Interpretar contenido", "kind": "activity"},
    {"id": "clear", "label": "Contenido interpretado", "kind": "decision"},
    {"id": "clarify", "label": "Solicitar aclaracion", "kind": "activity"},
    {"id": "classify", "label": "Clasificar intencion", "kind": "activity"},
    {"id": "confidence", "label": "Confianza suficiente", "kind": "decision"},
    {"id": "retrieve", "label": "Recuperar evidencia", "kind": "activity"},
    {"id": "evidence", "label": "Evidencia consistente", "kind": "decision"},
    {"id": "draft", "label": "Proponer respuesta", "kind": "activity"},
    {"id": "restricted", "label": "Decision restringida", "kind": "decision"},
    {"id": "approve", "label": "Solicitar aprobacion", "kind": "activity"},
    {"id": "execute", "label": "Ejecutar accion permitida", "kind": "activity"},
    {"id": "handoff", "label": "Escalar a persona", "kind": "activity"},
    {"id": "trace", "label": "Registrar trazabilidad", "kind": "activity"},
    {"id": "end", "label": "Fin", "kind": "end"}
  ],
  "edges": [
    {"id": "a01", "source": "start", "target": "receive", "label": ""},
    {"id": "a02", "source": "receive", "target": "interpret", "label": "solicitud"},
    {"id": "a03", "source": "interpret", "target": "clear", "label": "validar"},
    {"id": "a04", "source": "clear", "target": "clarify", "label": "No"},
    {"id": "a05", "source": "clarify", "target": "receive", "label": "respuesta"},
    {"id": "a06", "source": "clear", "target": "classify", "label": "Si"},
    {"id": "a07", "source": "classify", "target": "confidence", "label": "intencion"},
    {"id": "a08", "source": "confidence", "target": "clarify", "label": "No"},
    {"id": "a09", "source": "confidence", "target": "retrieve", "label": "Si"},
    {"id": "a10", "source": "retrieve", "target": "evidence", "label": "fuentes"},
    {"id": "a11", "source": "evidence", "target": "handoff", "label": "No"},
    {"id": "a12", "source": "evidence", "target": "draft", "label": "Si"},
    {"id": "a13", "source": "draft", "target": "restricted", "label": "respuesta"},
    {"id": "a14", "source": "restricted", "target": "approve", "label": "Si"},
    {"id": "a15", "source": "restricted", "target": "execute", "label": "No"},
    {"id": "a16", "source": "approve", "target": "execute", "label": "aprobado"},
    {"id": "a17", "source": "execute", "target": "trace", "label": "resultado"},
    {"id": "a18", "source": "handoff", "target": "trace", "label": "derivado"},
    {"id": "a19", "source": "trace", "target": "end", "label": "cierre"}
  ],
  "source_refs": ["fixture:diagram-layout:dense-activity"]
}
