{
  "schema_version": "diagram-model.v1",
  "diagram_key": "dense_agentic_architecture",
  "title": "Arquitectura agentica densa",
  "description": "Fixture de baseline con muchos nodos y relaciones cruzadas para reproducir saturacion visual.",
  "notation": "flowchart",
  "direction": "LR",
  "nodes": [
    {"id": "intake", "label": "Canales de entrada multicanal", "kind": "interface"},
    {"id": "normalize", "label": "Normalizacion y enriquecimiento de solicitud", "kind": "process"},
    {"id": "orchestrator", "label": "Supervisor agentico principal", "kind": "agent"},
    {"id": "intent", "label": "Clasificacion de intencion y prioridad", "kind": "agent_skill"},
    {"id": "retrieval", "label": "Recuperacion gobernada de conocimiento", "kind": "tool"},
    {"id": "record", "label": "Lectura de sistema fuente autorizado", "kind": "tool"},
    {"id": "policy", "label": "Aplicacion de reglas y politicas", "kind": "control"},
    {"id": "draft", "label": "Generacion de respuesta trazable", "kind": "capability"},
    {"id": "approval", "label": "Gate de aprobacion humana", "kind": "control"},
    {"id": "execute", "label": "Ejecucion permitida bajo contrato", "kind": "tool"},
    {"id": "memory", "label": "Memoria operacional y evidencia", "kind": "memory"},
    {"id": "audit", "label": "Registro de trazabilidad y auditoria", "kind": "data_store"},
    {"id": "handoff", "label": "Escalamiento a especialista humano", "kind": "handoff"},
    {"id": "notify", "label": "Notificacion y cierre del caso", "kind": "outcome"},
    {"id": "monitor", "label": "Monitoreo de calidad y drift", "kind": "observability"},
    {"id": "feedback", "label": "Aprendizaje por retroalimentacion aprobada", "kind": "feedback"}
  ],
  "edges": [
    {"id": "e01", "source": "intake", "target": "normalize", "label": "solicitud recibida"},
    {"id": "e02", "source": "normalize", "target": "orchestrator", "label": "contexto normalizado"},
    {"id": "e03", "source": "orchestrator", "target": "intent", "label": "delegar clasificacion"},
    {"id": "e04", "source": "intent", "target": "retrieval", "label": "necesita evidencia"},
    {"id": "e05", "source": "intent", "target": "record", "label": "consulta datos operativos"},
    {"id": "e06", "source": "retrieval", "target": "draft", "label": "fuentes citables"},
    {"id": "e07", "source": "record", "target": "policy", "label": "datos autorizados"},
    {"id": "e08", "source": "policy", "target": "draft", "label": "reglas aplicadas"},
    {"id": "e09", "source": "draft", "target": "approval", "label": "decision sensible"},
    {"id": "e10", "source": "approval", "target": "execute", "label": "accion aprobada"},
    {"id": "e11", "source": "approval", "target": "handoff", "label": "requiere humano"},
    {"id": "e12", "source": "execute", "target": "notify", "label": "resultado"},
    {"id": "e13", "source": "notify", "target": "audit", "label": "cierre trazable"},
    {"id": "e14", "source": "memory", "target": "orchestrator", "label": "contexto corto"},
    {"id": "e15", "source": "draft", "target": "memory", "label": "evidencia aprobada"},
    {"id": "e16", "source": "audit", "target": "monitor", "label": "metricas"},
    {"id": "e17", "source": "monitor", "target": "feedback", "label": "hallazgos"},
    {"id": "e18", "source": "feedback", "target": "policy", "label": "mejoras aprobadas"},
    {"id": "e19", "source": "orchestrator", "target": "policy", "label": "validar restricciones"},
    {"id": "e20", "source": "retrieval", "target": "approval", "label": "evidencia insuficiente"}
  ],
  "source_refs": ["fixture:diagram-layout:dense-agentic"]
}
